{"artifacts":[{"artifact_id":"benchmark-definition","digest":{"algorithm":"sha256","value":"10369a75658b07255d1b7b1ce34a46044c76e97ef31fe588b1a74dff9f2130db"},"executable":false,"media_type":"application/json","origin":"verified_evidence","path":"artifacts/benchmark-definition","role":"benchmark_definition","size_bytes":375},{"artifact_id":"software-manifest","digest":{"algorithm":"sha256","value":"8e8a873e7ccc4bac09f6cd606f9a4351d5c904c0bc04f85ae2b1aeee932c9964"},"executable":false,"media_type":"application/json","origin":"verified_evidence","path":"artifacts/software-manifest","role":"software_manifest","size_bytes":40},{"artifact_id":"dependency-lock","digest":{"algorithm":"sha256","value":"a97e3903110772ff38c3f51e7fba7f7c0f63cfc7c8a4708b1a4b88c495b72379"},"executable":false,"media_type":"application/json","origin":"verified_evidence","path":"artifacts/dependency-lock","role":"dependency_lock","size_bytes":15},{"artifact_id":"baseline-samples","digest":{"algorithm":"sha256","value":"aca507d2ec66041dadce015202db5e1c27ee4a9d09442776e2ecd22581bc5798"},"executable":false,"media_type":"application/json","origin":"performance_evidence","path":"artifacts/baseline-samples","role":"performance_samples","size_bytes":653},{"artifact_id":"candidate-samples","digest":{"algorithm":"sha256","value":"81fff7c29a74871db562bd8bedc6a0a476cf36648f4e8aafdbc1364f15ec54ed"},"executable":false,"media_type":"application/json","origin":"performance_evidence","path":"artifacts/candidate-samples","role":"performance_samples","size_bytes":652},{"artifact_id":"generated-runtime","digest":{"algorithm":"sha256","value":"d8fec71ac338c3600882e7fa9b5fb380ca6e491f976382f05c80a5df858d3d18"},"executable":false,"media_type":"application/zip","origin":"generated_untrusted","path":"artifacts/generated-runtime","role":"generated_runtime","size_bytes":3436},{"artifact_id":"deployment","digest":{"algorithm":"sha256","value":"a7db665e4fae85e52d0de65d5a4543e5121fe7d9999e41484bbf10cd15f202b5"},"executable":false,"media_type":"application/json","origin":"verified_evidence","path":"artifacts/deployment","role":"deployment","size_bytes":40},{"artifact_id":"rollback","digest":{"algorithm":"sha256","value":"f2dd61ab6dd82c87f54ec975353307ab99ccb65e001516e3a13c17fc19cb161e"},"executable":false,"media_type":"application/json","origin":"trusted","path":"artifacts/rollback","role":"rollback","size_bytes":37},{"artifact_id":"state-conversion","digest":{"algorithm":"sha256","value":"7674cb118775f9add6746002f5bfb6941e568ee53476d6cabfdc48de0b5000ac"},"executable":false,"media_type":"application/json","origin":"generated_untrusted","path":"artifacts/state-conversion","role":"state_conversion","size_bytes":195},{"artifact_id":"semantic-evidence","digest":{"algorithm":"sha256","value":"d559c2753b464a6b51d169c29a7190ee45424f819630d98e6a03b57ee71617ad"},"executable":false,"media_type":"application/json","origin":"verified_evidence","path":"artifacts/semantic-evidence","role":"semantic_evidence","size_bytes":106},{"artifact_id":"quality-evidence","digest":{"algorithm":"sha256","value":"147933803d3332d1d2bf8fe29bc87ece5f52ed5e35f5315a7acc7a97f783d404"},"executable":false,"media_type":"application/json","origin":"verified_evidence","path":"artifacts/quality-evidence","role":"quality_evidence","size_bytes":700},{"artifact_id":"resource-evidence","digest":{"algorithm":"sha256","value":"0a4793a7088fa96fcb12c2ac656e1cde9ddf8ffca07fbd029c9549b944612b9a"},"executable":false,"media_type":"application/json","origin":"verified_evidence","path":"artifacts/resource-evidence","role":"resource_evidence","size_bytes":929},{"artifact_id":"model-check-result","digest":{"algorithm":"sha256","value":"260c4b6ce1d76232e08f446dd307bb85d173e1c16bbe69f2380e5473f900adec"},"executable":false,"media_type":"application/json","origin":"formal_or_bounded_evidence","path":"artifacts/model-check-result","role":"model_check_result","size_bytes":242},{"artifact_id":"counterexample-corpus","digest":{"algorithm":"sha256","value":"718a3dbce31c3c1a9ce045cf158637740039cf927dff97ef3cc3505df0d25d0f"},"executable":false,"media_type":"application/json","origin":"verified_evidence","path":"artifacts/counterexample-corpus","role":"counterexample_corpus","size_bytes":238}],"benchmarks":[{"baseline_artifact_id":"baseline-samples","benchmark_id":"validator-vector","definition_artifact_id":"benchmark-definition","hardware_fingerprint":{"algorithm":"sha256","value":"7c75d9ee1d1d3d8bf9654f8c8ad4c8042d21ed0197ea6f4c884996907ea57dbf"},"noise_floor":0.05,"randomized_run_order":true,"raw_samples_artifact_id":"candidate-samples","repetitions":2,"sample_count":2,"software_manifest_artifact_id":"software-manifest","summary":{"confidence_high":11.0,"confidence_low":9.0,"effect_size":0.23076923076923078,"median":10.0,"metric":"validator-test-vector","objective":"minimize","practical_significance_threshold":0.1,"regression_probability":0.0,"tail_percentile":10.8,"tail_quantile":0.9,"unit":"dimensionless"},"warmup_iterations":1,"workload_fingerprint":{"algorithm":"sha256","value":"2996a53644c6b59517531e00a42f5e6885ab2e58bb2afe6d6faddb8dd0f6b6e6"}}],"capsule_digest":{"algorithm":"sha256","value":"c88c6c4b8c7aef72cbfb76ce391bc071ed705498713aba716e3d78a595e9f70c"},"claims":[{"category":"semantic","claim_id":"claim:semantic","evidence_ids":["evidence:semantic"],"level":"level_2_property","promotion_required":true,"result":"pass","scope":{"assumptions":["not evidence about deployed or hardware performance"],"dependency_requirements":[],"dtype_domain":[],"exclusions":[],"hardware_fingerprints":[{"algorithm":"sha256","value":"7c75d9ee1d1d3d8bf9654f8c8ad4c8042d21ed0197ea6f4c884996907ea57dbf"}],"input_domain":["bounded validator conformance vector"],"shape_domain":[]},"statement":"validator conformance fixture semantic claim"},{"category":"quality","claim_id":"claim:quality","evidence_ids":["evidence:quality"],"level":"level_2_property","promotion_required":true,"result":"pass","scope":{"assumptions":["not evidence about deployed or hardware performance"],"dependency_requirements":[],"dtype_domain":[],"exclusions":[],"hardware_fingerprints":[{"algorithm":"sha256","value":"7c75d9ee1d1d3d8bf9654f8c8ad4c8042d21ed0197ea6f4c884996907ea57dbf"}],"input_domain":["bounded validator conformance vector"],"shape_domain":[]},"statement":"validator conformance fixture quality claim"},{"category":"resource","claim_id":"claim:resource","evidence_ids":["evidence:resource"],"level":"level_2_property","promotion_required":true,"result":"pass","scope":{"assumptions":["not evidence about deployed or hardware performance"],"dependency_requirements":[],"dtype_domain":[],"exclusions":[],"hardware_fingerprints":[{"algorithm":"sha256","value":"7c75d9ee1d1d3d8bf9654f8c8ad4c8042d21ed0197ea6f4c884996907ea57dbf"}],"input_domain":["bounded validator conformance vector"],"shape_domain":[]},"statement":"validator conformance fixture resource claim"},{"category":"performance","claim_id":"claim:performance","evidence_ids":["evidence:performance"],"level":"level_5_hardware_operational","promotion_required":true,"result":"pass","scope":{"assumptions":["not evidence about deployed or hardware performance"],"dependency_requirements":[],"dtype_domain":[],"exclusions":[],"hardware_fingerprints":[{"algorithm":"sha256","value":"7c75d9ee1d1d3d8bf9654f8c8ad4c8042d21ed0197ea6f4c884996907ea57dbf"}],"input_domain":["bounded validator conformance vector"],"shape_domain":[]},"statement":"validator conformance fixture performance claim"},{"category":"operational","claim_id":"claim:operational","evidence_ids":["evidence:operational"],"level":"level_5_hardware_operational","promotion_required":true,"result":"pass","scope":{"assumptions":["not evidence about deployed or hardware performance"],"dependency_requirements":[],"dtype_domain":[],"exclusions":[],"hardware_fingerprints":[{"algorithm":"sha256","value":"7c75d9ee1d1d3d8bf9654f8c8ad4c8042d21ed0197ea6f4c884996907ea57dbf"}],"input_domain":["bounded validator conformance vector"],"shape_domain":[]},"statement":"validator conformance fixture operational claim"}],"dependencies":[{"name":"runtime","package_digest":null,"version":"1.0.0"}],"evidence":[{"artifact_ids":["semantic-evidence"],"assumptions":["isolated validator conformance fixture"],"deterministic_seed":73132,"evidence_class":"semantic","evidence_id":"evidence:semantic","issuer":"operator_verifier","issuer_version":"1.0.0","level":"level_2_property","observed_at":"2026-07-01T00:00:00Z","result":"pass","valid_until":"2027-07-01T00:00:00Z"},{"artifact_ids":["quality-evidence"],"assumptions":["isolated validator conformance fixture"],"deterministic_seed":73132,"evidence_class":"quality","evidence_id":"evidence:quality","issuer":"quality_harness","issuer_version":"1.0.0","level":"level_2_property","observed_at":"2026-07-01T00:00:00Z","result":"pass","valid_until":"2027-07-01T00:00:00Z"},{"artifact_ids":["resource-evidence"],"assumptions":["isolated validator conformance fixture"],"deterministic_seed":73132,"evidence_class":"resource","evidence_id":"evidence:resource","issuer":"resource_analyzer","issuer_version":"1.0.0","level":"level_2_property","observed_at":"2026-07-01T00:00:00Z","result":"pass","valid_until":"2027-07-01T00:00:00Z"},{"artifact_ids":["benchmark-definition","candidate-samples","software-manifest","baseline-samples"],"assumptions":["isolated validator conformance fixture"],"deterministic_seed":73132,"evidence_class":"performance","evidence_id":"evidence:performance","issuer":"benchmark_harness","issuer_version":"1.0.0","level":"level_5_hardware_operational","observed_at":"2026-07-01T00:00:00Z","result":"pass","valid_until":"2027-07-01T00:00:00Z"},{"artifact_ids":["model-check-result","state-conversion"],"assumptions":["isolated validator conformance fixture"],"deterministic_seed":73132,"evidence_class":"operational","evidence_id":"evidence:operational","issuer":"model_checker","issuer_version":"1.0.0","level":"level_5_hardware_operational","observed_at":"2026-07-01T00:00:00Z